{
  "entries": [
    {
      "handler_expression": "SpritePrep_Raven",
      "handler_label": "SpritePrep_Raven",
      "source_comment": "0x00 - $8969 Raven",
      "source_comment_continuations": [],
      "source_comment_sprite_type_id": 0,
      "source_description": "Raven",
      "source_handler_address_annotation": "$8969",
      "source_line": 13,
      "source_revision": "347c23f9fc019c72d32da537c9cb235f468d021d",
      "sprite_type_id": 0,
      "table_index": 0
    },
    {
      "handler_expression": "SpritePrep_Vulture",
      "handler_label": "SpritePrep_Vulture",
      "source_comment": "0x01 - $897E Vulture",
      "source_comment_continuations": [],
      "source_comment_sprite_type_id": 1,
      "source_description": "Vulture",
      "source_handler_address_annotation": "$897E",
      "source_line": 14,
      "source_revision": "347c23f9fc019c72d32da537c9cb235f468d021d",
      "sprite_type_id": 1,
      "table_index": 1
    },
    {
      "handler_expression": "SpritePrep_DoNothing",
      "handler_label": "SpritePrep_DoNothing",
      "source_comment": "0x02 - $8873 Flying Stalfos Head",
      "source_comment_continuations": [],
      "source_comment_sprite_type_id": 2,
      "source_description": "Flying Stalfos Head",
      "source_handler_address_annotation": "$8873",
      "source_line": 15,
      "source_revision": "347c23f9fc019c72d32da537c9cb235f468d021d",
      "sprite_type_id": 2,
      "table_index": 2
    },
    {
      "handler_expression": "$0000",
      "handler_label": null,
      "source_comment": "0x03 - $0000 Null sprite",
      "source_comment_continuations": [],
      "source_comment_sprite_type_id": 3,
      "source_description": "Null sprite",
      "source_handler_address_annotation": "$0000",
      "source_line": 16,
      "source_revision": "347c23f9fc019c72d32da537c9cb235f468d021d",
      "sprite_type_id": 3,
      "table_index": 3
    },
    {
      "handler_expression": "SpritePrep_GoodSwitch",
      "handler_label": "SpritePrep_GoodSwitch",
      "source_comment": "0x04 - $8859 Good Switch",
      "source_comment_continuations": [],
      "source_comment_sprite_type_id": 4,
      "source_description": "Good Switch",
      "source_handler_address_annotation": "$8859",
      "source_line": 17,
      "source_revision": "347c23f9fc019c72d32da537c9cb235f468d021d",
      "sprite_type_id": 4,
      "table_index": 4
    },
    {
      "handler_expression": "SpritePrep_DoNothing",
      "handler_label": "SpritePrep_DoNothing",
      "source_comment": "0x05 - $8873 Switch?",
      "source_comment_continuations": [],
      "source_comment_sprite_type_id": 5,
      "source_description": "Switch?",
      "source_handler_address_annotation": "$8873",
      "source_line": 18,
      "source_revision": "347c23f9fc019c72d32da537c9cb235f468d021d",
      "sprite_type_id": 5,
      "table_index": 5
    },
    {
      "handler_expression": "SpritePrep_GoodSwitch",
      "handler_label": "SpritePrep_GoodSwitch",
      "source_comment": "0x06 - $8859 Bad Switch",
      "source_comment_continuations": [],
      "source_comment_sprite_type_id": 6,
      "source_description": "Bad Switch",
      "source_handler_address_annotation": "$8859",
      "source_line": 19,
      "source_revision": "347c23f9fc019c72d32da537c9cb235f468d021d",
      "sprite_type_id": 6,
      "table_index": 6
    },
    {
      "handler_expression": "SpritePrep_SwitchFacingUp",
      "handler_label": "SpritePrep_SwitchFacingUp",
      "source_comment": "0x07 - $886D Switch again, facing up",
      "source_comment_continuations": [],
      "source_comment_sprite_type_id": 7,
      "source_description": "Switch again, facing up",
      "source_handler_address_annotation": "$886D",
      "source_line": 20,
      "source_revision": "347c23f9fc019c72d32da537c9cb235f468d021d",
      "sprite_type_id": 7,
      "table_index": 7
    },
    {
      "handler_expression": "SpritePrep_Octorock",
      "handler_label": "SpritePrep_Octorock",
      "source_comment": "0x08 - $8F71 Octorock",
      "source_comment_continuations": [],
      "source_comment_sprite_type_id": 8,
      "source_description": "Octorock",
      "source_handler_address_annotation": "$8F71",
      "source_line": 21,
      "source_revision": "347c23f9fc019c72d32da537c9cb235f468d021d",
      "sprite_type_id": 8,
      "table_index": 8
    },
    {
      "handler_expression": "SpritePrep_GiantMoldorm",
      "handler_label": "SpritePrep_GiantMoldorm",
      "source_comment": "0x09 - $8F8A Giant Moldorm",
      "source_comment_continuations": [],
      "source_comment_sprite_type_id": 9,
      "source_description": "Giant Moldorm",
      "source_handler_address_annotation": "$8F8A",
      "source_line": 22,
      "source_revision": "347c23f9fc019c72d32da537c9cb235f468d021d",
      "sprite_type_id": 9,
      "table_index": 9
    },
    {
      "handler_expression": "SpritePrep_Octorock",
      "handler_label": "SpritePrep_Octorock",
      "source_comment": "0x0A - $8F71 Four Shooter Octorock",
      "source_comment_continuations": [],
      "source_comment_sprite_type_id": 10,
      "source_description": "Four Shooter Octorock",
      "source_handler_address_annotation": "$8F71",
      "source_line": 23,
      "source_revision": "347c23f9fc019c72d32da537c9cb235f468d021d",
      "sprite_type_id": 10,
      "table_index": 10
    },
    {
      "handler_expression": "SpritePrep_DoNothing",
      "handler_label": "SpritePrep_DoNothing",
      "source_comment": "0x0B - $8873 Chicken / Chicken Lady",
      "source_comment_continuations": [],
      "source_comment_sprite_type_id": 11,
      "source_description": "Chicken / Chicken Lady",
      "source_handler_address_annotation": "$8873",
      "source_line": 24,
      "source_revision": "347c23f9fc019c72d32da537c9cb235f468d021d",
      "sprite_type_id": 11,
      "table_index": 11
    },
    {
      "handler_expression": "SpritePrep_DoNothing",
      "handler_label": "SpritePrep_DoNothing",
      "source_comment": "0x0C - $8873 Octorock projectile",
      "source_comment_continuations": [],
      "source_comment_sprite_type_id": 12,
      "source_description": "Octorock projectile",
      "source_handler_address_annotation": "$8873",
      "source_line": 25,
      "source_revision": "347c23f9fc019c72d32da537c9cb235f468d021d",
      "sprite_type_id": 12,
      "table_index": 12
    },
    {
      "handler_expression": "SpritePrep_DoNothing",
      "handler_label": "SpritePrep_DoNothing",
      "source_comment": "0x0D - $8873 Buzzblob",
      "source_comment_continuations": [],
      "source_comment_sprite_type_id": 13,
      "source_description": "Buzzblob",
      "source_handler_address_annotation": "$8873",
      "source_line": 26,
      "source_revision": "347c23f9fc019c72d32da537c9cb235f468d021d",
      "sprite_type_id": 13,
      "table_index": 13
    },
    {
      "handler_expression": "SpritePrep_DoNothing",
      "handler_label": "SpritePrep_DoNothing",
      "source_comment": "0x0E - $8873 Plants with big mouths",
      "source_comment_continuations": [],
      "source_comment_sprite_type_id": 14,
      "source_description": "Plants with big mouths",
      "source_handler_address_annotation": "$8873",
      "source_line": 27,
      "source_revision": "347c23f9fc019c72d32da537c9cb235f468d021d",
      "sprite_type_id": 14,
      "table_index": 14
    },
    {
      "handler_expression": "SpritePrep_Octoballoon",
      "handler_label": "SpritePrep_Octoballoon",
      "source_comment": "0x0F - $8910 Octoballoon",
      "source_comment_continuations": [],
      "source_comment_sprite_type_id": 15,
      "source_description": "Octoballoon",
      "source_handler_address_annotation": "$8910",
      "source_line": 28,
      "source_revision": "347c23f9fc019c72d32da537c9cb235f468d021d",
      "sprite_type_id": 15,
      "table_index": 15
    },
    {
      "handler_expression": "SpritePrep_DoNothing",
      "handler_label": "SpritePrep_DoNothing",
      "source_comment": "0x10 - $8873 Octospawn",
      "source_comment_continuations": [],
      "source_comment_sprite_type_id": 16,
      "source_description": "Octospawn",
      "source_handler_address_annotation": "$8873",
      "source_line": 29,
      "source_revision": "347c23f9fc019c72d32da537c9cb235f468d021d",
      "sprite_type_id": 16,
      "table_index": 16
    },
    {
      "handler_expression": "SpritePrep_DoNothing",
      "handler_label": "SpritePrep_DoNothing",
      "source_comment": "0x11 - $8873 Hinox",
      "source_comment_continuations": [],
      "source_comment_sprite_type_id": 17,
      "source_description": "Hinox",
      "source_handler_address_annotation": "$8873",
      "source_line": 30,
      "source_revision": "347c23f9fc019c72d32da537c9cb235f468d021d",
      "sprite_type_id": 17,
      "table_index": 17
    },
    {
      "handler_expression": "SpritePrep_DoNothing",
      "handler_label": "SpritePrep_DoNothing",
      "source_comment": "0x12 - $8873 Moblin",
      "source_comment_continuations": [],
      "source_comment_sprite_type_id": 18,
      "source_description": "Moblin",
      "source_handler_address_annotation": "$8873",
      "source_line": 31,
      "source_revision": "347c23f9fc019c72d32da537c9cb235f468d021d",
      "sprite_type_id": 18,
      "table_index": 18
    },
    {
      "handler_expression": "SpritePrep_Helmasaur",
      "handler_label": "SpritePrep_Helmasaur",
      "source_comment": "0x13 - $9151 Helmasaur",
      "source_comment_continuations": [],
      "source_comment_sprite_type_id": 19,
      "source_description": "Helmasaur",
      "source_handler_address_annotation": "$9151",
      "source_line": 32,
      "source_revision": "347c23f9fc019c72d32da537c9cb235f468d021d",
      "sprite_type_id": 19,
      "table_index": 19
    },
    {
      "handler_expression": "SpritePrep_GargoyleGrate",
      "handler_label": "SpritePrep_GargoyleGrate",
      "source_comment": "0x14 - $8BC4 Gargoyle Grate",